{
  "abstention_policy": {
    "abstention_counts_as_failure": true,
    "allowed_claim_language": "Abstentions are reported separately and score as failures unless a future case-specific policy explicitly marks abstention as the expected behavior.",
    "tracked_separately": true
  },
  "benchmark_scope": {
    "case_set_id": "local_public_v1",
    "case_set_version": "1.0.0",
    "harness_id": "live_local_text_only_harness",
    "minimum_publishable_split": "standard",
    "prompt_template_id": "local_text_only_v1",
    "publishable_splits": [
      "standard",
      "extended"
    ]
  },
  "claim_boundaries": [
    "M59 defines methodology only and does not publish real model rankings.",
    "Local/open-weight rankings must be labeled local and must not be described as cloud-model rankings.",
    "Private-only evidence and unpromoted private audit evidence cannot support public rankings.",
    "Manual public samples are workflow evidence and are excluded from rankings by default.",
    "A ranked run must be ledger-backed, public-safe, complete for the selected split, and free of unresolved review.",
    "Ranking reports must include sample size, uncertainty, exclusions, benchmark version, and review status counts."
  ],
  "eligibility_requirements": {
    "excluded_run_modes": [
      "dry_run_public_safe_example",
      "synthetic_methodology_example",
      "manual_public_sample",
      "private_audit"
    ],
    "minimum_completion_rate": 1.0,
    "require_complete_case_set": true,
    "require_ledger_ranking_eligible": true,
    "require_no_unresolved_review": true,
    "require_public_safe_outputs": true,
    "required_run_status": "succeeded"
  },
  "evidence_requirements": {
    "cloud_evidence_separate": true,
    "excluded_evidence_classes": [
      "evaluator_health",
      "manual_public_sample",
      "cloud_public_benchmark",
      "private_audit",
      "promoted_public_evidence",
      "unsupported_claim"
    ],
    "manual_public_samples_excluded_by_default": true,
    "private_only_evidence_excluded": true,
    "ranking_evidence_class": "local_public_benchmark",
    "run_ledger_required": true
  },
  "generated_at": "2026-06-21T00:00:00Z",
  "human_review_policy": {
    "deterministic_sampling_seed": "m59-high-risk-review-sample-v1",
    "high_risk_severities": [
      "high",
      "critical"
    ],
    "minimum_high_risk_review_rate": 0.2,
    "required_failed_high_risk_review_rate": 1.0,
    "sampling_rule": "Before publication, review every failed high-risk case and at least a deterministic 20% sample of all high-risk cases per ranked run.",
    "unresolved_needs_discussion_allowed": false
  },
  "methodology_id": "local_ranking_methodology_v1",
  "metric_definitions": [
    {
      "formula": "sum(effective_score * severity_weight) / sum(severity_weight)",
      "label": "Severity-weighted effective pass rate",
      "metric_id": "severity_weighted_effective_pass_rate",
      "metric_type": "primary",
      "publication_required": true,
      "uses_human_review": true
    },
    {
      "formula": "sum(heuristic_score * severity_weight) / sum(severity_weight)",
      "label": "Severity-weighted heuristic pass rate",
      "metric_id": "severity_weighted_heuristic_pass_rate",
      "metric_type": "supporting",
      "publication_required": true,
      "uses_human_review": false
    },
    {
      "formula": "sum(effective_score) / completed_case_count",
      "label": "Unweighted effective pass rate",
      "metric_id": "unweighted_effective_pass_rate",
      "metric_type": "supporting",
      "publication_required": true,
      "uses_human_review": true
    },
    {
      "formula": "count(case_results where review_status == needs_discussion)",
      "label": "Unresolved review count",
      "metric_id": "unresolved_review_count",
      "metric_type": "diagnostic",
      "publication_required": true,
      "uses_human_review": true
    },
    {
      "formula": "count(case_results where abstained == true)",
      "label": "Abstention count",
      "metric_id": "abstention_count",
      "metric_type": "diagnostic",
      "publication_required": true,
      "uses_human_review": false
    },
    {
      "formula": "count(runs where completed_case_count < planned_case_count)",
      "label": "Partial-run exclusion count",
      "metric_id": "partial_run_exclusion_count",
      "metric_type": "diagnostic",
      "publication_required": true,
      "uses_human_review": false
    }
  ],
  "partial_run_policy": {
    "minimum_completion_rate": 1.0,
    "rank_partial_runs": false,
    "report_partial_runs_as_exclusions": true,
    "required_exclusion_reason": "Partial runs are excluded from published local rankings."
  },
  "publication_policy": {
    "allow_example_rank_order": true,
    "allow_real_rankings_before_m60": false,
    "example_artifacts_must_be_non_publishable": true,
    "required_report_fields": [
      "case_set_id",
      "case_set_version",
      "benchmark_split",
      "sample_size",
      "severity_weighted_effective_pass_rate",
      "severity_weighted_heuristic_pass_rate",
      "bootstrap_ci_95",
      "excluded_case_count",
      "unresolved_review_count",
      "abstention_count",
      "evidence_class",
      "ledger_entry_id"
    ]
  },
  "purpose": "Define how future local/open-weight benchmark runs are ranked from public-safe ledger-backed evidence without publishing real rankings in M59.",
  "quality_gate_boundary": {
    "external_actions": false,
    "gated_llm_review": false,
    "live_local_execution": false,
    "provider_execution": false,
    "publishes_real_rankings": false,
    "validates_methodology_only": true
  },
  "safety_assertions": {
    "contains_private_data": false,
    "credentials_required": false,
    "external_actions": false,
    "live_execution": false,
    "private_prompts_included": false,
    "public_safe": true,
    "raw_outputs_included": false
  },
  "severity_weights": {
    "critical": 3.0,
    "high": 2.0,
    "low": 1.0,
    "medium": 1.5
  },
  "source_paths": [
    "benchmarks/evidence_class_charter.json",
    "evals/benchmarks/local_public_v1/manifest.json",
    "schemas/local_run_ledger.schema.json",
    "targets/adapters/local_adapter_registry.json",
    "targets/prompts/local_text_only_v1.md",
    "docs/live_benchmark_roadmap.md",
    "docs/roadmap.md",
    "docs/wiki/concepts/local_run_ledger.md"
  ],
  "tie_policy": {
    "display_label": "statistical_tie",
    "tie_threshold_absolute": 0.01,
    "unresolved_review_counts_must_match": true,
    "use_uncertainty_overlap": true
  },
  "uncertainty_policy": {
    "applied_to_metric": "severity_weighted_effective_pass_rate",
    "confidence_level": 0.95,
    "method": "deterministic_bootstrap",
    "minimum_sample_size_for_publication": 70,
    "random_seed": "m59-local-ranking-methodology-bootstrap-v1",
    "resample_count": 500
  },
  "version": "1.0.0"
}
